{  "schema_version": "1.0",  "video_id": "demo_video_001",  "analysis_id": "demo_analysis_001",  "source_kind": "mock",  "model_version": "mock-fixture-v1",  "video_sha256": "0000000000000000000000000000000000000000000000000000000000000000",  "duration_s": 120.0,  "sample_interval_s": 1.0,  "behavior_catalog": [    {"code": "standing", "label": "站立", "definition": "演示类别：站立且未标为采食；不代表实际模型标注标准。", "source_class_id": 0},    {"code": "feeding", "label": "采食", "definition": "演示类别：采食；真实接入时须由视觉同学提供实际标注定义。", "source_class_id": 1},    {"code": "lying", "label": "卧躺", "definition": "演示类别：卧躺；不表示健康判断。", "source_class_id": 2}  ],  "tracks": [    {      "track_id": "track_001",      "observed_intervals": [{"start_s": 0.0, "end_s": 100.0}],      "segments": [        {"segment_id": "seg_001", "start_s": 0.0, "end_s": 20.0, "behavior": "standing"},        {"segment_id": "seg_002", "start_s": 20.0, "end_s": 50.0, "behavior": "feeding"},        {"segment_id": "seg_003", "start_s": 50.0, "end_s": 60.0, "behavior": "unknown"},        {"segment_id": "seg_004", "start_s": 60.0, "end_s": 100.0, "behavior": "lying"}      ]    }  ],  "detections": [],  "warnings": [    "本结果为工程演示，不来自真实奶牛识别。",    "video_sha256 为占位值；seed 脚本必须生成测试视频并替换真实指纹、视频编号和分析编号后才能导入。",    "100 至 120 秒没有有效观察记录，不得推断该时段的行为。",    "没有检测框数据，前端不得伪造框叠加。"  ]}